{
  "schemaVersion": "1.0.0",
  "title": "InnovaTeQ and Felelősségteljes IT: SEO and AI-search review",
  "eyebrow": "Search & marketing audit · 2026-10-01",
  "lede": "A prioritised list for innovateq.io and felelosit.hu. Each item says what to change, why it matters, how to fix it and roughly how long it takes. Everything is checked read-only: no forms submitted, no load tests.",
  "meta": "Checked: https://innovateq-website.innovateq-solutions.workers.dev/ (staging), https://innovateq.io/; https://felelosit.hu/. Automated collectors: HTTP crawl, robots/sitemap/llms.txt, on-page meta, JSON-LD. Optional: Lighthouse, keyword APIs, live AI answers (see agent checklist).",
  "generatedAt": "2026-10-01T09:41:21.720Z",
  "method": "Method: read-only HTTP checks of seed + sitemap URLs, on-page SEO extraction, robots.txt / sitemap / llms.txt, JSON-LD entity scan. Keyword volumes, backlink graphs and live ChatGPT/Perplexity answers are filled by the auditing agent when enabled. No forms submitted, no load tests.",
  "summary": [
    "**InnovaTeQ:** 0 P0 item(s), 8 findings total, 4 strengths noted.",
    "**Felelősségteljes IT:** 0 P0 item(s), 4 findings total, 4 strengths noted.",
    "Each finding says what to change, why it matters, how to fix it and roughly how long it takes. Checks are read-only: no forms submitted, no load tests."
  ],
  "sites": [
    {
      "siteId": "innovateq",
      "name": "InnovaTeQ",
      "primaryUrl": "https://innovateq.io/",
      "stagingUrl": "https://innovateq-website.innovateq-solutions.workers.dev/",
      "stats": [
        {
          "value": "32",
          "label": "pages crawled successfully (of 37)"
        },
        {
          "value": "15",
          "label": "URLs discovered via sitemap"
        },
        {
          "value": "yes",
          "label": "llms.txt"
        },
        {
          "value": "yes",
          "label": "homepage title present"
        }
      ],
      "alreadyDoneWell": [
        "Sitemap discoverable and referenced from robots.txt.",
        "Hand-served llms.txt is present.",
        "Staging host sends noindex (X-Robots-Tag).",
        "Structured data includes organisation-like types: Organization."
      ],
      "findings": [
        {
          "id": "innovateq-meta-basics",
          "priority": "IMPORTANT",
          "level": "P1",
          "category": "technical",
          "title": "Fix titles, meta descriptions and H1s",
          "effort": "1–2 h",
          "what": "1 page(s) with no H1; 6 page(s) with multiple H1s",
          "why": "Titles and a single clear H1 are the baseline for both classic SEO and AI citation snippets.",
          "fix": "Give every indexable page a unique title, a meta description, and exactly one H1 that matches the page intent.",
          "evidence": [
            "https://innovateq.io/blogs/"
          ],
          "relatedUrls": [
            "https://innovateq.io/blogs/"
          ],
          "artifacts": [],
          "agentAction": {
            "type": "edit_html_meta"
          }
        },
        {
          "id": "innovateq-schema-sameas",
          "priority": "IMPORTANT",
          "level": "P1",
          "category": "entity_brand",
          "title": "Richer structured data (sameAs, founder, services)",
          "effort": "2–3 h",
          "what": "Organisation schema exists but is thin: missing sameAs profile links and/or founder / Service / article markup.",
          "why": "With a shared or ambiguous name, schema is how Google and AI systems tell this business apart.",
          "fix": "Extend Organization/ProfessionalService with address, vatID/taxID, foundingDate, areaServed, knowsAbout, sameAs. Add Person for the founder, BlogPosting on articles, BreadcrumbList on inner pages.",
          "evidence": [],
          "relatedUrls": [
            "https://innovateq-website.innovateq-solutions.workers.dev/"
          ],
          "artifacts": [
            {
              "name": "sample-organization-schema.json",
              "kind": "schema_json",
              "content": "{\n  \"@context\": \"https://schema.org\",\n  \"@graph\": [\n    {\n      \"@type\": \"ProfessionalService\",\n      \"@id\": \"https://innovateq.io/#organization\",\n      \"name\": \"InnovaTeQ\",\n      \"legalName\": \"InnovaTeQ Solutions Kft.\",\n      \"url\": \"https://innovateq.io/\",\n      \"knowsAbout\": [\n        \"performance engineering consulting\",\n        \"observability consulting\",\n        \"incident root cause analysis\",\n        \"monitoring strategy\",\n        \"performance testing consultancy\"\n      ],\n      \"sameAs\": []\n    }\n  ]\n}"
            }
          ],
          "agentAction": {
            "type": "edit_schema"
          }
        },
        {
          "id": "innovateq-og-image",
          "priority": "NICE_TO_HAVE",
          "level": "P2",
          "category": "technical",
          "title": "A proper social preview image",
          "effort": "30 min",
          "what": "og:image is set but twitter:card is \"summary\" (prefer summary_large_image with a 1200×630 image).",
          "why": "Shared links on LinkedIn otherwise show a cropped logo or empty preview.",
          "fix": "Create one 1200×630 image (logo + headline), set as default og:image, use summary_large_image.",
          "evidence": [],
          "relatedUrls": [
            "https://innovateq-website.innovateq-solutions.workers.dev/"
          ],
          "artifacts": [],
          "agentAction": {
            "type": "add_file",
            "target": "og-default.png"
          }
        },
        {
          "id": "innovateq-mailto-form",
          "priority": "IMPORTANT",
          "level": "P1",
          "category": "conversion",
          "title": "The contact form posts to mailto:",
          "effort": "1 h",
          "what": "Found mailto form action(s): https://innovateq-website.innovateq-solutions.workers.dev/book-a-call/ → mailto:info@innovateq.io; https://innovateq-website.innovateq-solutions.workers.dev/request-tailored-offer/ → mailto:info@innovateq.io; https://innovateq-website.innovateq-solutions.workers.dev/thank-you/ → mailto:info@innovateq.io; https://innovateq-website.innovateq-solutions.workers.dev/contact/ → mailto:info@innovateq.io",
          "why": "This is a conversion issue more than an SEO one, but it is the page SEO work sends people to. On many phones and locked-down work machines, mailto does nothing.",
          "fix": "Post to a real form endpoint (HubSpot, Formspree, etc.) and show the email address as plain-text fallback.",
          "evidence": [
            "https://innovateq-website.innovateq-solutions.workers.dev/book-a-call/ → mailto:info@innovateq.io",
            "https://innovateq-website.innovateq-solutions.workers.dev/request-tailored-offer/ → mailto:info@innovateq.io",
            "https://innovateq-website.innovateq-solutions.workers.dev/thank-you/ → mailto:info@innovateq.io",
            "https://innovateq-website.innovateq-solutions.workers.dev/contact/ → mailto:info@innovateq.io"
          ],
          "relatedUrls": [
            "https://innovateq-website.innovateq-solutions.workers.dev/book-a-call/",
            "https://innovateq-website.innovateq-solutions.workers.dev/request-tailored-offer/",
            "https://innovateq-website.innovateq-solutions.workers.dev/thank-you/",
            "https://innovateq-website.innovateq-solutions.workers.dev/contact/"
          ],
          "artifacts": [],
          "agentAction": {
            "type": "other",
            "notes": "Wire form to CRM/endpoint"
          }
        },
        {
          "id": "innovateq-keyword-context",
          "priority": "CONTEXT",
          "level": "P1",
          "category": "content_keywords",
          "title": "Search demand and content fit",
          "effort": "ongoing",
          "what": "Configured focus themes/keywords to validate with search-volume data: performance engineering consulting, observability consulting, incident root cause analysis, monitoring strategy, performance testing consultancy.",
          "why": "Category keywords often have tiny demand for advisory businesses; buyers search symptoms or ask AI assistants.",
          "fix": "Pull monthly volumes (DataForSEO / Ads Keyword Planner) for the configured markets, then write problem-led pages that open with a two-sentence direct answer and link to the matching service.",
          "evidence": [
            "performance engineering consulting",
            "observability consulting",
            "incident root cause analysis",
            "monitoring strategy",
            "performance testing consultancy"
          ],
          "relatedUrls": [],
          "artifacts": [],
          "agentAction": {
            "type": "manual_check",
            "notes": "Fill volumes via keyword collector or agent research, then prioritise content."
          }
        },
        {
          "id": "innovateq-geo-checks",
          "priority": "CHECK",
          "level": "P1",
          "category": "geo_ai",
          "title": "How AI search sees the brand (manual / API pass)",
          "effort": "30–60 min",
          "what": "Live ChatGPT / Perplexity / AI Overview answers were not auto-fetched in this run. Use the configured questions.",
          "why": "Assistants still describe brands from old crawls; redirects and llms.txt decide how fast that updates.",
          "fix": "Ask each question with web search enabled, record citations, and compare to the intended positioning. Re-run 2–4 weeks after major changes.",
          "evidence": [
            "What is InnovaTeQ?",
            "Who is Ádám Tóth InnovaTeQ?",
            "Independent performance and observability consultants in Hungary or Europe",
            "Is InnovaTeQ a training company?"
          ],
          "relatedUrls": [],
          "artifacts": [
            {
              "name": "geo-questions.md",